{
  "title": "Hotărârea Guvernului nr. 492 din 5 iulie 2018 pentru aprobarea Regulamentului privind controlul de stat al calității în construcții",
  "short_title": "HG 492/2018",
  "canonical_citation": "HG nr. 492/2018",
  "type": "hotarare",
  "number": "492",
  "year": "2018",
  "issuer": "Guvernul României",
  "issuing_body_kind": "guvern",
  "domain": "calitate",
  "topics": ["calitate-constructii", "control-de-stat", "regulament-control"],
  "status": "unknown",
  "issue_date": "2018-07-05",
  "publication_date": "2018-07-12",
  "publication_medium": "monitorul-oficial",
  "source_url": "https://legislatie.just.ro/Public/DetaliiDocument/202598",
  "official_source": "Portal Legislativ — Hotărârea Guvernului nr. 492/2018; Monitorul Oficial al României, Partea I, nr. 594 din 12 iulie 2018",
  "official_detail_url": "https://legislatie.just.ro/Public/DetaliiDocument/202598",
  "version_kind": "original",
  "last_checked": "2026-08-15",
  "version": "Forma oficială originală a hotărârii și regulamentului anexat; cele două documente Portal sunt combinate în textul actului",
  "article_count": 18,
  "annex_count": 1,
  "effective_date": "2018-09-10",
  "import_method": "Portal Legislativ forme HTML oficiale (hotărâre + regulament separat) → extracție structurală mecanică → Markdown combinat",
  "rights_note": "Portal Legislativ confirmă identitatea hotărârii și a regulamentului anexat, publicarea în Monitorul Oficial al României, Partea I, nr. 594 din 12 iulie 2018 și forma originală. Textul integral combină documentele Portal 202598 și 202599 în actul existent; cele 18 articole juridice sunt ancorate art-*, iar cele 23 de prevederi tehnice S_PCT sunt ancorate pct-*. Anexa este ancorată anexa-1. Art. 3 prevede intrarea în vigoare la 60 de zile de la publicare; effective_date 2018-09-10 și relația existentă implements -> lege-10-1995 sunt păstrate. Art. 4 abrogă HG nr. 272/1994, documentată în text fără relație nouă. Nu s-au folosit OCR, PDF, DOCX sau binare sursă; statusul curent rămâne unknown.",
  "implements": ["lege-10-1995"],
  "relationships": [
    {
      "type": "implements",
      "target": "lege-10-1995",
      "confidence": "confirmed",
      "evidence_type": "explicit_text",
      "evidence": "Art. 2 prevede că regulamentul se aplică tuturor factorilor implicați în procesul de construire, în conformitate cu art. 6 alin. (2) din Legea nr. 10/1995; preambulul citează de asemenea art. 9 lit. k), art. 20, art. 33, art. 34 și art. 41 din aceeași lege.",
      "source_article": "Preambul; Art. 2",
      "source_url": "https://legislatie.just.ro/Public/DetaliiDocument/202598",
      "reviewed_by": "codex",
      "reviewed_at": "2026-08-12"
    }
  ],
  "tags": ["calitate", "control-de-stat", "regulament", "hotarare-guvern"]
}
