{
  "title": "Legea nr. 98 din 19 mai 2016 (actualizată) privind achizițiile publice",
  "short_title": "Legea 98/2016 privind achizițiile publice",
  "canonical_citation": "Legea nr. 98/2016",
  "type": "lege",
  "number": "98",
  "year": "2016",
  "issuer": "Parlamentul României",
  "issuing_body_kind": "parlament",
  "domain": "urbanism",
  "topics": [
    "achizitii-publice",
    "lucrari-publice",
    "contracte-de-lucrari",
    "constructii"
  ],
  "status": "unknown",
  "issue_date": "2016-05-19",
  "publication_date": "2016-05-23",
  "effective_date": "2016-05-26",
  "publication_medium": "monitorul-oficial",
  "source_url": "https://legislatie.just.ro/Public/DetaliiDocument/183887",
  "official_source": "Portal Legislativ — forma consolidată; publicată inițial în Monitorul Oficial nr. 390 din 23 mai 2016",
  "official_detail_url": "https://legislatie.just.ro/Public/DetaliiDocument/183887",
  "version_kind": "consolidat",
  "last_checked": "2026-08-16",
  "version": "forma consolidată afișată de Portalul Legislativ și marcată actualizată; Portalul nu afișează o dată distinctă de consolidare",
  "article_count": 240,
  "annex_count": 2,
  "import_method": "metadata-only",
  "rights_note": "Import metadata-only. Portalul Legislativ rămâne sursa oficială. Art. 240 alin. (1) stabilește intrarea generală în vigoare la 3 zile de la publicare, calculată la 26.05.2016; alin. (2) stabilește o intrare diferențiată pentru art. 199 alin. (2), la 18.10.2018. Nu se importă textul integral sau anexele.",
  "tags": [
    "achizitii-publice",
    "lucrari-publice",
    "contracte-de-lucrari",
    "constructii",
    "lege",
    "forma-consolidata",
    "metadata-only"
  ]
}
