{
  "title": "Ordin nr. 995 din 24 iunie 2014 pentru aprobarea reglementării tehnice \"Normativ privind proiectarea geotehnică a lucrărilor de epuizmente\", indicativ NP 134-2014",
  "short_title": "NP 134-2014",
  "canonical_citation": "NP 134:2014",
  "type": "normativ",
  "number": "995",
  "year": "2014",
  "issuer": "Ministerul Dezvoltării Regionale și Administrației Publice",
  "issuing_body_kind": "minister",
  "domain": "calitate",
  "topics": [
    "geotehnic",
    "epuizmente",
    "fundatii",
    "constructii",
    "normativ-tehnic",
    "np134"
  ],
  "status": "unknown",
  "issue_date": "2014-06-24",
  "publication_date": "2014-08-11",
  "effective_date": "2014-09-10",
  "publication_medium": "monitorul-oficial",
  "source_url": "https://legislatie.just.ro/Public/DetaliiDocument/160581",
  "official_source": "Portal Legislativ — Ordinul nr. 995 din 24 iunie 2014; publicat în Monitorul Oficial nr. 597 din 11 august 2014; anexa NP 134-2014 publicată în nr. 597 bis",
  "official_detail_url": "https://legislatie.just.ro/Public/DetaliiDocument/160581",
  "version_kind": "original",
  "last_checked": "2026-08-18",
  "version": "forma oficială originală a ordinului aprobator; reglementarea tehnică NP 134-2014 este anexă publicată în M.Of. nr. 597 bis și nu este creată ca nod separat",
  "article_count": 2,
  "annex_count": 1,
  "import_method": "metadata-only",
  "implements": [
    "lege-10-1995",
    "hg-203-2003"
  ],
  "relationships": [
    {
      "type": "implements",
      "target": "lege-10-1995",
      "confidence": "confirmed",
      "evidence_type": "explicit_text",
      "evidence": "Preambulul invocă explicit art. 10 și art. 38 alin. (2) din Legea nr. 10/1995 privind calitatea în construcții, cu modificările ulterioare.",
      "source_article": "Preambul",
      "source_url": "https://legislatie.just.ro/Public/DetaliiDocument/160581",
      "reviewed_by": "codex",
      "reviewed_at": "2026-08-18"
    },
    {
      "type": "implements",
      "target": "hg-203-2003",
      "confidence": "confirmed",
      "evidence_type": "explicit_text",
      "evidence": "Preambulul invocă explicit art. 2 alin. (3) și (4) din Regulamentul aprobat prin Hotărârea Guvernului nr. 203/2003, cu modificările și completările ulterioare.",
      "source_article": "Preambul",
      "source_url": "https://legislatie.just.ro/Public/DetaliiDocument/160581",
      "reviewed_by": "codex",
      "reviewed_at": "2026-08-18"
    }
  ],
  "rights_note": "Import metadata-only pentru ordinul aprobator. Art. 1 aprobă reglementarea tehnică NP 134-2014 ca anexă care face parte integrantă din ordin; nota oficială precizează că anexa se publică în M.Of. nr. 597 bis. Art. 2 stabilește intrarea în vigoare la 30 de zile de la publicare; effective_date 2014-09-10 este calculată determinist din data publicării 2014-08-11 + 30 de zile. Portalul a returnat HTTP 403 pentru requesturile directe; identitatea și structura au fost reconfirmate prin browser fallback la 2026-08-18T16:33:53.978Z. Hashurile DOM din audit sunt ale document.documentElement.outerHTML, nu ale răspunsului HTTP. Nu se importă textul tehnic și nu se creează nod separat pentru anexă.",
  "tags": [
    "geotehnic",
    "epuizmente",
    "fundatii",
    "constructii",
    "normativ-tehnic",
    "mdlrap",
    "np134",
    "metadata-only"
  ]
}
