{
  "title": "Hotărârea Guvernului nr. 845 din 24 octombrie 2018 pentru aprobarea Regulamentului privind recepția construcțiilor din domeniul infrastructurii rutiere și feroviare de interes național",
  "short_title": "HG 845/2018",
  "canonical_citation": "Hotărârea Guvernului nr. 845/2018",
  "type": "hotarare",
  "number": "845",
  "year": "2018",
  "issuer": "Guvernul României",
  "issuing_body_kind": "guvern",
  "domain": "receptie",
  "topics": ["receptie", "infrastructura-rutiera", "infrastructura-feroviara", "constructii"],
  "status": "unknown",
  "issue_date": "2018-10-24",
  "publication_date": "2018-11-06",
  "publication_medium": "monitorul-oficial",
  "source_url": "https://legislatie.just.ro/Public/DetaliiDocument/279235",
  "official_source": "Portal Legislativ — Hotărârea Guvernului nr. 845/2018 (document 279235) și Regulamentul anexat (document 206438); Monitorul Oficial al României, Partea I, nr. 934 din 6 noiembrie 2018",
  "official_detail_url": "https://legislatie.just.ro/Public/DetaliiDocument/279235",
  "version_kind": "original",
  "last_checked": "2026-08-15",
  "version": "Forma originală oficială a hotărârii și regulamentului anexat; documentele Portal 279235 și 206438 sunt combinate în actul existent. Forma consolidată reflectă modificarea ulterioară prin HG 172/2024, care nu este importată în acest text original.",
  "article_count": 44,
  "annex_count": 4,
  "import_method": "Portal Legislativ forme HTML oficiale (hotărâre + regulament separat) → extracție structurală mecanică → Markdown combinat",
  "rights_note": "Portal Legislativ confirmă identitatea hotărârii și regulamentului anexat, publicarea în Monitorul Oficial al României, Partea I, nr. 934 din 6 noiembrie 2018 și forma originală. Textul integral combină documentele Portal 279235 și 206438 în actul existent: 44 articole juridice, 26 prevederi tehnice S_PCT și 4 ancore de anexă (anexa hotărârii și anexele 1-3 ale regulamentului). Nu s-au folosit OCR, PDF, DOCX sau binare sursă. Forma consolidată indică modificarea ulterioară prin HG 172/2024, dar acest import păstrează forma originală și nu modifică relațiile existente. Statusul rămâne unknown, iar effective_date rămâne omisă.",
  "implements": ["lege-10-1995"],
  "related_acts": ["hg-273-1994"],
  "relationships": [
    {
      "type": "implements",
      "target": "lege-10-1995",
      "confidence": "confirmed",
      "evidence_type": "explicit_text",
      "evidence": "Preambulul invocă art. 9 lit. i), art. 17 și art. 41 alin. (1^1) din Legea nr. 10/1995 privind calitatea în construcții.",
      "source_article": "Preambul",
      "source_url": "https://legislatie.just.ro/Public/DetaliiDocument/279235?isFormaDeBaza=True&rep=True",
      "reviewed_by": "codex",
      "reviewed_at": "2026-08-15"
    },
    {
      "type": "references",
      "target": "hg-273-1994",
      "confidence": "confirmed",
      "evidence_type": "explicit_text",
      "evidence": "Art. 2 prevede aplicarea regulamentului în condițiile Hotărârii Guvernului nr. 273/1994 pentru aprobarea Regulamentului privind recepția construcțiilor, cu modificările și completările ulterioare.",
      "source_article": "Art. 2",
      "source_url": "https://legislatie.just.ro/Public/DetaliiDocument/279235?isFormaDeBaza=True&rep=True",
      "reviewed_by": "codex",
      "reviewed_at": "2026-08-15"
    }
  ],
  "tags": ["guvern", "receptie", "infrastructura-rutiera", "infrastructura-feroviara", "constructii"]
}
