{
  "title": "Ordin nr. 172 din 1 februarie 2023 pentru aprobarea reglementării tehnice \"Normativ pentru proiectarea parcajelor, indicativ NP 24-2022\"",
  "short_title": "Ordin MDLPA 172/2023",
  "canonical_citation": "Ordinul MDLPA nr. 172/2023",
  "type": "ordin",
  "number": "172",
  "year": "2023",
  "issuer": "Ministerul Dezvoltării, Lucrărilor Publice și Administrației",
  "issuing_body_kind": "minister",
  "domain": "calitate",
  "topics": ["parcaje", "constructii", "siguranta-in-exploatare", "normativ-tehnic", "np24-2022"],
  "status": "unknown",
  "issue_date": "2023-02-01",
  "publication_date": "2023-02-08",
  "publication_medium": "monitorul-oficial",
  "source_url": "https://legislatie.just.ro/Public/DetaliiDocument/264676",
  "official_source": "Portal Legislativ — Ordinul nr. 172 din 1 februarie 2023; Monitorul Oficial al României, Partea I, nr. 110 din 8 februarie 2023 și nr. 110 bis pentru anexă",
  "official_detail_url": "https://legislatie.just.ro/Public/DetaliiDocument/264676",
  "version_kind": "original",
  "last_checked": "2026-08-15",
  "version": "Forma oficială a ordinului; NP 24-2022 este anexă și nu este reimportat ca text integral",
  "article_count": 5,
  "annex_count": 1,
  "effective_date": "2023-03-10",
  "import_method": "metadata-only",
  "rights_note": "Art. 1 aprobă reglementarea tehnică NP 24-2022, prevăzută în anexa care face parte integrantă din ordin. Preambulul citează explicit art. 10 din Legea nr. 10/1995 și art. 2 din regulamentul aprobat prin HG nr. 203/2003; relațiile repo-locale sunt modelate ca implements. Art. 2 prevede intrarea în vigoare în 30 de zile de la publicare, iar 2023-03-10 este derivată mecanic din M.Of. nr. 110/08.02.2023. Art. 3 stabilește excluderi tranzitorii pentru investiții și documentații aflate în curs. Art. 4 și art. 5 stabilesc încetarea aplicabilității unor acte externe privind NP 24-1997 și P 132-93. Statusul curent nu este declarat și rămâne unknown. Textul ordinului nu este importat integral, iar NP 24-2022 există deja în repository.",
  "implements": ["lege-10-1995", "hg-203-2003"],
  "approves": ["normativ-np24-2022"],
  "relationships": [
    {
      "type": "approves",
      "target": "normativ-np24-2022",
      "confidence": "confirmed",
      "evidence_type": "explicit_text",
      "evidence": "Art. 1 aprobă reglementarea tehnică „Normativ pentru proiectarea parcajelor“, indicativ NP 24-2022, prevăzută în anexa care face parte integrantă din ordin.",
      "source_article": "Art. 1",
      "source_url": "https://legislatie.just.ro/Public/DetaliiDocument/264676",
      "reviewed_by": "codex",
      "reviewed_at": "2026-08-15"
    },
    {
      "type": "implements",
      "target": "lege-10-1995",
      "confidence": "confirmed",
      "evidence_type": "explicit_text",
      "evidence": "Preambulul invocă explicit art. 10 din Legea nr. 10/1995 privind calitatea în construcții.",
      "source_article": "Preambul",
      "source_url": "https://legislatie.just.ro/Public/DetaliiDocument/264676",
      "reviewed_by": "codex",
      "reviewed_at": "2026-08-15"
    },
    {
      "type": "implements",
      "target": "hg-203-2003",
      "confidence": "confirmed",
      "evidence_type": "explicit_text",
      "evidence": "Preambulul invocă explicit art. 2 din regulamentul privind activitatea de reglementare în construcții și categoriile de cheltuieli aferente, aprobat prin HG nr. 203/2003.",
      "source_article": "Preambul",
      "source_url": "https://legislatie.just.ro/Public/DetaliiDocument/264676",
      "reviewed_by": "codex",
      "reviewed_at": "2026-08-15"
    }
  ],
  "tags": ["mdlpa", "calitate", "parcaje", "constructii", "siguranta-in-exploatare", "normativ-tehnic", "np24-2022"]
}
