{
  "title": "Prescripție Tehnică PT C 8-2010 privind instalațiile de distribuție gaze petroliere lichefiate",
  "short_title": "PT C 8-2010",
  "canonical_citation": "PT C 8-2010",
  "type": "normativ",
  "number": "663",
  "year": "2010",
  "issuer": "Ministerul Economiei, Comerțului și Mediului de Afaceri",
  "issuing_body_kind": "minister",
  "domain": "iscir",
  "topics": ["instalatii-gpl", "gaze-petroliere-lichefiate", "instalatii-sub-presiune", "securitate-tehnica", "PTC8"],
  "status": "active",
  "issue_date": "2010-04-12",
  "publication_date": "2010-06-10",
  "effective_date": "2010-07-10",
  "publication_medium": "monitorul-oficial",
  "version_kind": "original",
  "last_checked": "2026-07-03",
  "source_url": "https://iscir.ro/prescriptii-iscir",
  "official_detail_url": "https://iscir.ro/wp-content/uploads/2011/03/PTC1C4C6C7C8C9C102010.pdf",
  "import_method": "metadata-only",
  "rights_note": "Prescripție tehnică ISCIR aprobată prin Ordinul M.E.C.M.A. nr. 663/12.04.2010 (Art. 5, anexa nr. 5), publicată în Monitorul Oficial al României, Partea I, nr. 385/10.06.2010 (ordin) și nr. 385 bis/10.06.2010 (anexe PT C1, C4, C6, C7, C8, C9, C10). Intră în vigoare la 30 de zile de la publicare (Art. 10), respectiv 10.07.2010. Art. 8 lit. e) abrogă Ordinul ministrului economiei și comerțului nr. 309/2003 pentru PT C 8-2003, publicat în M.Of. nr. 910 și 910 bis din 19 decembrie 2003. Ordinul M.E. nr. 557/28.04.2014 (M.Of. nr. 336/08.05.2014) a fost verificat direct (PDF integral, 1 pagină): ART. I pct. 2 abrogă lit. h) de la anexa nr. 5 articolul 104, deci modifică direct PT C8-2010; această intrare rămâne metadata-only și nu reproduce text consolidat. PDF-ul oficial combinat ISCIR (496 pagini) a fost descărcat și verificat direct: pagina 303 (Anexa nr. 5) confirmă indicativul 'PT C 8-2010', titlul 'INSTALAȚII DE DISTRIBUȚIE GAZE PETROLIERE LICHEFIATE' și Ediția 1. Metadata-only — textul integral nu este importat în acest repo.",
  "tags": ["iscir", "gpl", "instalatii-gpl", "instalatii-sub-presiune", "securitate-tehnica", "prescriptie-tehnica", "ptc8"],
  "related_acts": ["lege-64-2008"]
}
