{
  "title": "Normativ pentru proiectarea, executarea şi exploatarea instalaţiilor de stingere a incendiilor, indicativ NP 086-2005",
  "short_title": "NP 086-2005",
  "canonical_citation": "NP 086-2005",
  "type": "normativ",
  "number": "217",
  "year": "2005",
  "issuer": "Ministerul Transporturilor, Construcțiilor și Turismului",
  "issuing_body_kind": "minister",
  "domain": "incendiu",
  "topics": ["instalatii-stingere-incendii", "securitate-incendiu", "normativ-tehnic"],
  "status": "repealed",
  "issue_date": "2005-02-17",
  "publication_date": "2005-06-07",
  "effective_date": "2005-07-07",
  "publication_medium": "monitorul-oficial",
  "version_kind": "original",
  "last_checked": "2026-07-02",
  "source_url": "https://legislatie.just.ro/Public/DetaliiDocumentAfis/62176",
  "official_detail_url": "https://www.mdlpa.ro/pages/reglementare28",
  "import_method": "metadata-only",
  "rights_note": "Aprobat prin Ordinul ministrului transporturilor, construcțiilor și turismului nr. 217/17.02.2005, publicat în Monitorul Oficial al României, Partea I, nr. 479 din 7 iunie 2005 (Portal Legislativ, DetaliiDocumentAfis/62176). Titlul ordinului de aprobare folosește forma scurtă a indicativului 'NP 086-05'; textul de abrogare din Ordinul MDRAP nr. 2.463/2013 (care aprobă P118/2-2013) citează forma 'NP 086-2005' — ambele desemnează același act; canonical_citation folosește forma din urmă, consistentă cu convenția de denumire a acestui repo. Art. 2 din Ordinul nr. 217/2005 prevede intrarea în vigoare la 30 de zile de la data publicării; effective_date este calculată ca 2005-07-07. Status: abrogat. Confirmat independent din două surse primare: (1) Ordinul MDRAP nr. 2.463/08.08.2013 (Portal Legislativ, DetaliiDocumentAfis/151521), Art. 3: 'La data intrării în vigoare a prezentului ordin, Ordinul ministrului transporturilor, construcțiilor și turismului nr. 217/2005 pentru aprobarea Reglementării tehnice ... indicativ NP 086-2005, publicat în Monitorul Oficial al României, Partea I, nr. 479 din 7 iunie 2005, se abrogă.'; (2) pagina MDLPA reglementare28 (poziția XXVIII-15, intrarea P 118/2-2013): 'se abrogă NP 086-2005'. Ambele surse coincid exact asupra referinței Monitorul Oficial. Nu a fost identificată o pagină MDLPA proprie pentru NP 086-2005 (act pre-2013, neurmărit ca intrare activă în tabelul reglementare28); official_detail_url indică pagina MDLPA care confirmă abrogarea. Metadata-only — textul integral nu este importat în acest repo.",
  "tags": ["instalatii-stingere-incendii", "securitate-incendiu", "normativ-tehnic", "constructii", "np086"],
  "related_acts": [],
  "amended_by": ["normativ-p118-2-2013"]
}
