{
  "title": "Ghid privind implementarea măsurilor de creștere a performanței energetice aplicabile clădirilor noi, în etapele de proiectare, execuție și recepție, exploatare și urmărire a comportării în timp pentru îndeplinirea cerințelor nZEB, indicativ RTC 4-2022",
  "short_title": "RTC 4-2022",
  "canonical_citation": "RTC 4-2022",
  "type": "ghid",
  "number": "2818",
  "year": "2022",
  "issuer": "Ministerul Dezvoltării, Lucrărilor Publice și Administrației",
  "issuing_body_kind": "minister",
  "domain": "nzeb",
  "topics": ["performanta-energetica", "nZEB", "cladiri-noi", "ghid", "rtc4"],
  "status": "unknown",
  "issue_date": "2022-11-02",
  "publication_date": "2022-11-15",
  "effective_date": "2022-12-15",
  "publication_medium": "monitorul-oficial",
  "version_kind": "original",
  "last_checked": "2026-08-03",
  "source_url": "https://www.mdlpa.ro/pages/reglementare27",
  "official_source": "MDLPA — Reglementări tehnice în construcții, poziția XXVII-21; O.M.D.L.P.A. nr. 2818/02.11.2022",
  "official_detail_url": "https://www.mdlpa.ro/uploads/articole/attachments/637493e15e0e7300492713.docx",
  "version": "ghid tehnic original; textul integral nu este importat",
  "import_method": "metadata-only",
  "rights_note": "Pagina oficială MDLPA confirmă indicativul RTC 4-2022, titlul, aprobarea prin O.M.D.L.P.A. nr. 2818/02.11.2022, publicarea în M.Of. nr. 1098 și 1098 bis din 15.11.2022 și intrarea în vigoare la 15.12.2022. Documentul oficial citează explicit Legea nr. 10/1995, Legea nr. 372/2005 și Legea nr. 50/1991. Citațiile către Mc 001 identificate în document se referă la Mc 001-2006; nu se adaugă relație către metodologie-mc001-2022. Statusul juridic actual nu este declarat explicit și este păstrat unknown. Textul tehnic integral nu este importat.",
  "related_acts": ["lege-10-1995", "lege-372-2005", "lege-50-1991"],
  "tags": ["performanta-energetica", "nzeb", "cladiri-noi", "ghid-tehnic", "mdlpa", "rtc4"]
}
