{
  "title": "Normativ privind proiectarea clădirilor civile din punct de vedere al cerinței de siguranță în exploatare, indicativ NP 068-2002",
  "short_title": "NP 068-2002",
  "canonical_citation": "NP 068-2002",
  "type": "normativ",
  "number": "1576",
  "year": "2002",
  "issuer": "Ministerul Lucrărilor Publice, Transporturilor și Locuinței",
  "issuing_body_kind": "minister",
  "domain": "calitate",
  "topics": ["siguranta-in-exploatare", "proiectare", "cladiri-civile", "calitate-constructii"],
  "status": "unknown",
  "issue_date": "2002-10-15",
  "publication_medium": "portal-legislativ",
  "version_kind": "original",
  "last_checked": "2026-08-02",
  "source_url": "https://legislatie.just.ro/Public/DetaliiDocument/259738",
  "official_source": "Portal Legislativ — REGLEMENTĂRI din 20 septembrie 2022, Tabelul 1.1, poziția 12",
  "official_detail_url": "https://legislatie.just.ro/Public/DetaliiDocument/259738",
  "version": "normativ original aprobat prin Ordinul ministrului lucrărilor publice, transporturilor și locuinței nr. 1576/15.10.2002",
  "import_method": "metadata-only",
  "rights_note": "Portal Legislativ confirmă titlul canonic, indicativul NP 068-2002 și aprobarea prin Ordinul ministrului lucrărilor publice, transporturilor și locuinței nr. 1576/15.10.2002. Evidența oficială verificată nu indică un număr/data de Monitorul Oficial sau Buletinul Construcțiilor și nu indică separat data intrării în vigoare; aceste câmpuri sunt omise. Statusul este unknown deoarece sursa de referință nu declară explicit starea juridică actuală. Textul tehnic integral nu este importat.",
  "related_acts": [],
  "tags": ["siguranta-in-exploatare", "proiectare", "cladiri-civile", "calitate-constructii", "mdlpa", "np068"]
}
