{
  "title": "Ordonanță de urgență nr. 17 din 12 martie 2026 privind modificarea și completarea unor acte normative",
  "short_title": "OUG 17/2026",
  "canonical_citation": "OUG nr. 17/2026",
  "type": "ordonanta",
  "number": "17",
  "year": "2026",
  "issuer": "Guvernul României",
  "issuing_body_kind": "guvern",
  "domain": "incendiu",
  "topics": ["securitate-la-incendiu", "autorizatii-incendiu", "constructii", "situatii-urgenta"],
  "status": "unknown",
  "issue_date": "2026-03-12",
  "publication_date": "2026-03-13",
  "publication_medium": "monitorul-oficial",
  "version_kind": "original",
  "last_checked": "2026-08-02",
  "source_url": "https://legislatie.just.ro/Public/FormaPrintabila/00000G1G0RY488TEEI21D9MC87ZMW3VA",
  "official_source": "Portal Legislativ — forma printabilă oficială; M.Of. nr. 199/13.03.2026; nu a fost identificat un URL DetaliiDocument canonical separat",
  "official_detail_url": "https://legislatie.just.ro/Public/FormaPrintabila/00000G1G0RY488TEEI21D9MC87ZMW3VA",
  "version": "forma originală publicată în M.Of. nr. 199/13.03.2026",
  "import_method": "metadata-only",
  "rights_note": "OUG nr. 17/12.03.2026 este publicată în M.Of. nr. 199/13.03.2026. Art. VI modifică și completează Legea nr. 307/2006, inclusiv cadrul pentru avizele și autorizațiile de securitate la incendiu, construcții, amenajări și instalații. Art. VII modifică și completează Legea nr. 10/1995. Nu se introduce un effective_date unic: Art. XIII prevede aplicarea la data publicării pentru Art. VII, iar Art. XV prevede intrarea în vigoare la 30 de zile pentru modificările indicate din Art. VI. Statusul este unknown deoarece sursa nu afișează un câmp explicit de status. Actele externe OUG 46/2022, Legea 21/1996 și Legea 7/1996 sunt doar documentate ca referințe și nu sunt importate.",
  "amends": ["lege-307-2006", "lege-10-1995"],
  "relationships": [
    {
      "type": "amends",
      "target": "lege-307-2006",
      "confidence": "confirmed",
      "evidence_type": "explicit_text",
      "evidence": "Art. VI din OUG nr. 17/2026 prevede explicit că Legea nr. 307/2006 privind apărarea împotriva incendiilor se modifică și se completează.",
      "source_article": "Art. VI",
      "source_url": "https://legislatie.just.ro/Public/FormaPrintabila/00000G1G0RY488TEEI21D9MC87ZMW3VA",
      "reviewed_by": "codex",
      "reviewed_at": "2026-08-02"
    },
    {
      "type": "amends",
      "target": "lege-10-1995",
      "confidence": "confirmed",
      "evidence_type": "explicit_text",
      "evidence": "Art. VII din OUG nr. 17/2026 prevede explicit că Legea nr. 10/1995 privind calitatea în construcții se modifică și se completează.",
      "source_article": "Art. VII",
      "source_url": "https://legislatie.just.ro/Public/FormaPrintabila/00000G1G0RY488TEEI21D9MC87ZMW3VA",
      "reviewed_by": "codex",
      "reviewed_at": "2026-08-02"
    }
  ],
  "tags": ["securitate-la-incendiu", "autorizatii-incendiu", "constructii", "situatii-urgenta", "oug17", "amendament"]
}
