{
  "title": "LEGE nr. 51 din 8 martie 2006 (**republicată**) privind serviciile comunitare de utilități publice",
  "short_title": "Legea serviciilor comunitare de utilități publice 51/2006",
  "canonical_citation": "Legea nr. 51/2006",
  "type": "lege",
  "number": "51",
  "year": "2006",
  "issuer": "Parlamentul României",
  "issuing_body_kind": "parlament",
  "domain": "executie",
  "topics": ["utilități-publice", "infrastructură-tehnico-edilitară", "apă", "canalizare", "salubrizare", "servicii-publice"],
  "status": "unknown",
  "issue_date": "2006-03-08",
  "publication_date": "2013-03-05",
  "effective_date": "2007-03-21",
  "publication_medium": "monitorul-oficial",
  "source_url": "https://legislatie.just.ro/Public/DetaliiDocument/215292",
  "official_source": "Portal Legislativ — forma republicată și consolidarea din 25.02.2026 a Legii nr. 51/2006; publicată inițial în M.Of. nr. 254/21.03.2006 și republicată în M.Of. nr. 121/05.03.2013",
  "official_detail_url": "https://legislatie.just.ro/Public/DetaliiDocument/215292",
  "version_kind": "republicat",
  "consolidated_as_of": "2026-02-25",
  "last_checked": "2026-08-25",
  "version": "Forma consolidată indicată de Portal la 25.02.2026; republicarea este publicată în M.Of. nr. 121/05.03.2013.",
  "article_count": 58,
  "annex_count": 0,
  "import_method": "metadata-only",
  "rights_note": "Textul legal nu este importat. Art. 54 prevede intrarea în vigoare la un an de la publicarea în Monitorul Oficial, cu excepția art. 42 alin. (7); pornind de la publicarea inițială confirmată în M.Of. nr. 254/21.03.2006, data generală este calculată determinist ca 21.03.2007. Statusul rămâne unknown deoarece Portalul afișează forma republicată și istoricul consolidărilor, fără o etichetă explicită de status juridic curent. Actele modificatoare și Legea nr. 241/2006 menționate în nota de republicare rămân externe/absente și nu sunt importate.",
  "relationships": [
    {
      "type": "references",
      "target": "lege-50-1991",
      "confidence": "confirmed",
      "evidence_type": "explicit_text",
      "evidence": "Forma oficială citează Legea nr. 50/1991 privind autorizarea executării lucrărilor de construcții, republicată, cu modificările și completările ulterioare, în dispoziția privind lucrările de infrastructură și serviciile de utilități publice.",
      "source_article": "Art. 43",
      "source_url": "https://legislatie.just.ro/Public/DetaliiDocument/307034",
      "reviewed_by": "codex",
      "reviewed_at": "2026-08-25"
    }
  ],
  "tags": ["lege", "utilități-publice", "infrastructură-tehnico-edilitară", "apă", "canalizare", "salubrizare", "metadata-only"]
}
