{
  "title": "Ordonanța de urgență a Guvernului nr. 34 din 19 aprilie 2006 privind atribuirea contractelor de achiziție publică, a contractelor de concesiune de lucrări publice și a contractelor de concesiune de servicii",
  "short_title": "OUG 34/2006 — achiziții publice",
  "canonical_citation": "OUG nr. 34/2006",
  "type": "ordonanta",
  "number": "34",
  "year": "2006",
  "issuer": "Guvernul României",
  "issuing_body_kind": "guvern",
  "domain": "urbanism",
  "topics": ["achizitii-publice", "achizitii-electronice", "contracte-de-lucrari", "concesiuni", "norme-metodologice"],
  "status": "repealed",
  "issue_date": "2006-04-19",
  "publication_date": "2006-05-15",
  "effective_date": "2006-06-30",
  "publication_medium": "monitorul-oficial",
  "source_url": "https://legislatie.just.ro/Public/DetaliiDocument/71663",
  "official_detail_url": "https://legislatie.just.ro/Public/DetaliiDocument/71663",
  "official_source": "Portal Legislativ — forma consolidată a OUG nr. 34 din 19 aprilie 2006; publicată inițial în Monitorul Oficial al României, Partea I, nr. 418 din 15 mai 2006; forma printabilă oficială verificată separat",
  "version_kind": "consolidat",
  "last_checked": "2026-08-28",
  "version": "Forma consolidată afișată de Portalul Legislativ, cu modificările și completările indicate în notele actului; forma auditată are 367 blocuri de articole și 9 anexe",
  "article_count": 367,
  "annex_count": 9,
  "import_method": "metadata-only",
  "rights_note": "Import metadata-only pentru forma consolidată oficială a OUG nr. 34/19.04.2006. Art. 307 alin. (1) stabilește intrarea în vigoare la data de 30 iunie 2006, iar alin. (2) stabilește date diferențiate pentru anumite dispoziții; effective_date reprezintă data generală explicită, fără a elimina aceste excepții. Legea nr. 98/2016, art. 238 lit. a), abrogă expres OUG nr. 34/2006 la data intrării în vigoare a legii; schema repository-ului nu suportă repeals/repealed_by, astfel abrogarea este documentată fără edge inexact. OUG nr. 34/2006 este cadrul juridic explicit pentru HG nr. 925/2006 și HG nr. 1.660/2006, iar aceste inverse source-backed sunt adăugate în metadata actelor locale. OUG nr. 34/2006 și Legea nr. 337/2006 rămân citate în act, dar nu sunt create noduri suplimentare. Textul integral, tabelele și anexele nu sunt importate.",
  "tags": ["ordonanta", "achizitii-publice", "achizitii-electronice", "contracte-de-lucrari", "concesiuni", "norme-metodologice", "istoric", "metadata-only"]
}
