{
  "title": "Cod de proiectare seismică – Partea I – Prevederi de proiectare pentru clădiri, indicativ P 100-1/2013",
  "short_title": "Normativ P 100-1/2013",
  "canonical_citation": "P 100-1/2013",
  "type": "normativ",
  "number": "2465",
  "year": "2013",
  "issuer": "Ministerul Dezvoltării Regionale și Administrației Publice",
  "issuing_body_kind": "minister",
  "domain": "calitate",
  "topics": ["seismic", "proiectare-seismica", "cod-proiectare", "cladiri", "p100"],
  "status": "active",
  "issue_date": "2013-08-08",
  "publication_date": "2013-09-03",
  "publication_medium": "monitorul-oficial",
  "version_kind": "original",
  "last_checked": "2026-06-29",
  "source_url": "https://www.mdlpa.ro/pages/reglementare1",
  "official_detail_url": "https://www.mdlpa.ro/pages/reglementare1",
  "import_method": "metadata-only",
  "rights_note": "Normativ tehnic aprobat prin O.M.D.R.A.P. nr. 2.465/08.08.2013, publicat în M.Of., Partea I, nr. 558 bis/03.09.2013. Completare aprobată prin O.M.D.R.A.P. nr. 2.956/18.11.2019, publicată în M.Of., Partea I, nr. 928/18.11.2019. Metadata-only — textul nu este importat în acest repo.",
  "tags": ["seismic", "proiectare-seismica", "cladiri", "cod-de-proiectare", "p100", "mdlpa", "antiseismic"],
  "related_acts": ["lege-10-1995", "lege-50-1991"],
  "amended_by": ["normativ-p100-1-2013-completare-2019"]
}
